{
  "id": "msiri",
  "nom": "Msiri",
  "variantes": [
    "M'siri",
    "Mushidi",
    "Msidi",
    "Mwenda",
    "Ngelengwa",
    "Mwenda Msiri Ngelengwa"
  ],
  "region": "afrique-centrale",
  "categorie": "heros",
  "peuples": [
    "Yeke",
    "Sumbwa",
    "Nyamwezi"
  ],
  "resume": "Msiri, de son nom de naissance Ngelengwa, est un marchand venu du pays sumbwa, dans l'actuelle Tanzanie, qui fonda au XIXe siècle le royaume yeke, ou Garenganze, dans le sud-est du Katanga. Établi dans la région vers le milieu du siècle, il en contrôla le cuivre, l'ivoire et la traite des captifs, avec Bunkeya pour capitale. Il fut tué le 20 décembre 1891 par un officier de l'expédition Stairs, envoyée par l'État indépendant du Congo.",
  "description_detaillee": "Msiri est le fondateur du royaume yeke, l'un des États nés au XIXe siècle de l'essor du commerce à longue distance en Afrique centrale. Les Yeke sont des Sumbwa et des Nyamwezi, venus de l'ouest de l'actuelle Tanzanie sur les routes caravanières qui reliaient l'intérieur à la côte de l'océan Indien, et qui s'établirent au Katanga, dans une région déjà connue pour ses mines de cuivre. En quelques décennies, Msiri fit de ce groupe de marchands le centre d'un royaume qui commerçait à la fois avec les deux côtes du continent.\n\nSelon les traditions yeke étudiées par l'historien Pierre Kalenga Ngoy, Ngelengwa naît au Busumbwa, dans le village de Kazimana, fils de Kalasa Mazwiri, un marchand qui avait déjà conduit des caravanes jusqu'au Katanga pour en rapporter du cuivre. Le nom de Ngelengwa signifierait « celui qui étonnera le monde ». Il accompagne son père, puis revient avec ses propres gens et met ses armes à feu au service des chefs locaux : il épouse la fille du chef Katanga, l'aide contre ses rivaux, puis s'installe chez Pande, chef des Sanga, dont il prend la place à sa mort. Il s'affirme ensuite contre le Kazembe, le grand royaume lunda de la Luapula, entre 1862 et 1866 selon Hugues Legros, et se proclame mwami (roi) vers 1875. Au moment de son intronisation, il reprend le nom d'un ancêtre, Mwenda ; celui de Mushidi ou Msiri, qui n'est pas sumbwa, ne lui vient qu'au sommet de sa puissance. Vers 1879-1880, il fixe sa capitale à Bunkeya, dans un site choisi à la fois pour ses terres fertiles et pour le contrôle des routes. Le royaume vit du cuivre, de l'ivoire, du sel et des captifs, échangés contre des fusils et de la poudre avec les marchands swahili de l'est et les caravanes venues d'Angola à l'ouest ; le mwami se réserve les deux défenses de chaque éléphant abattu et les peaux de fauves qui servent aux insignes royaux.\n\nLa fin du royaume tient à la course des puissances européennes vers les mines du Katanga. Après l'Allemand Reichard en 1884, Msiri reçoit en 1886 le missionnaire écossais Frederick Stanley Arnot, que les marchands swahili présents à sa cour tentent de discréditer ; il refuse de traiter avec la British South Africa Company, puis voit arriver en 1891 plusieurs expéditions de l'État indépendant du Congo de Léopold II. Le 20 décembre 1891, alors que l'expédition du capitaine William Stairs exige sa soumission, il est abattu par l'officier belge Omer Bodson, mortellement blessé à son tour par un des hommes du roi. Stairs installe comme successeur l'un de ses fils adoptifs, Mukanda Bantu, à la tête d'un territoire réduit au voisinage de Bunkeya.\n\nLes chefs yeke de Bunkeya portent encore le titre de Mwami Mwenda et se présentent comme les successeurs de Msiri. Son royaume, qui n'a duré qu'une génération, illustre la manière dont le commerce caravanier du XIXe siècle a pu faire naître des États nouveaux autour de marchands étrangers, avant que la conquête coloniale n'y mette fin ; les principales sources sur son règne restent les traditions yeke et les récits des voyageurs et missionnaires européens qui l'ont rencontré.",
  "domaines": [
    "royauté",
    "commerce à longue distance",
    "conquête"
  ],
  "tags": [
    "royaute-sacree"
  ],
  "genealogie": {
    "parents": [],
    "conjoints": [],
    "enfants": [],
    "entites_liees": []
  },
  "attributs": [
    "Bunkeya",
    "cuivre du Katanga",
    "ivoire",
    "armes à feu",
    "titre de mwami"
  ],
  "recits_associes": [],
  "culte_contemporain": "La chefferie des Bayeke, dont le siège est à Bunkeya (province du Lualaba, RDC), est dirigée par un Mwami Mwenda qui se réclame de Msiri. La mort du roi est commémorée chaque 20 décembre à Bunkeya ; ces informations proviennent de la presse congolaise et de notices en ligne, non de travaux académiques.",
  "sources": [
    "Kalenga Ngoy, P.C. (2014). Bunkeya et ses chefs : évolution sociale d'une ville précoloniale (1870-1992). Thèse de doctorat, Université de Leiden",
    "Legros, H. (1996). Chasseurs d'ivoire : une histoire du royaume yeke du Shaba (Zaïre). Éditions de l'Université de Bruxelles",
    "Encyclopaedia Britannica (s.d.). Msiri. britannica.com"
  ],
  "notes": "La date de naissance de Msiri est incertaine : un récit yeke publié par Jean-Claude Maton la fixe au 20 décembre 1824 d'après une éclipse, d'autres notices donnent vers 1830. Son installation au Katanga est placée vers 1850 (Kalenga) ou vers 1856 (Britannica). Kalenga conteste l'idée, répandue chez Arnot et Moloney, d'un Kalasa vassal du chef nyamwezi Mirambo, contemporain plus jeune de Msiri. Plusieurs notices en ligne affirment que les hommes de Stairs décapitèrent le corps du roi ; ce détail ne repose que sur ces notices. Les circonstances précises de sa mort (tentative d'arrestation hors de Bunkeya ou négociation) et l'installation de Mukanda Bantu, présenté comme fils adoptif, reposent sur Britannica et sur des notices encyclopédiques en ligne. L'étymologie du nom Garenganze n'est pas établie."
}
