{
  "id": "nhialic",
  "nom": "Nhialic",
  "variantes": [
    "Nhialiac"
  ],
  "region": "afrique-est",
  "categorie": "deites",
  "peuples": [
    "Dinka"
  ],
  "resume": "Dieu créateur suprême et esprit du ciel dans la cosmologie dinka (Soudan du Sud), source ultime de la pluie, de la vie et de l'ordre moral. Généralement distant, approché via des esprits intermédiaires (jok/yeeth) ou des figures comme Deng.",
  "description_detaillee": "L'anthropologue Godfrey Lienhardt distingue dans la pensée dinka les 'libres-divinités' (yeeth), manifestations de Nhialic accessibles à l'ensemble de la société, des 'divinités claniques' (jok), esprits particuliers attachés à des lignages spécifiques et transmis héréditairement. Deng se situe précisément à l'articulation de ces catégories, à la fois expression directe et accessible de Nhialic et figure vénérée de façon particulière par certains clans sacerdotaux, illustrant la porosité entre transcendance universelle et particularisme lignager dans la théologie dinka.",
  "domaines": [
    "création",
    "ciel",
    "pluie",
    "ordre moral"
  ],
  "tags": [
    "creation"
  ],
  "genealogie": {
    "parents": [],
    "conjoints": [],
    "enfants": [
      "deng"
    ],
    "entites_liees": [
      "deng"
    ]
  },
  "attributs": [],
  "recits_associes": [
    "abuk-garang"
  ],
  "culte_contemporain": "",
  "sources": [
    "Lienhardt, G. (1961). Divinity and Experience: The Religion of the Dinka",
    "Deng, F.M. (1972). The Dinka of the Sudan"
  ],
  "notes": ""
}
