{
  "id": "amadioha",
  "nom": "Amadioha",
  "variantes": [
    "Amadiọha",
    "Amadiora",
    "Kamalu",
    "Igwe",
    "Ofufe"
  ],
  "region": "afrique-ouest",
  "categorie": "deites",
  "peuples": [
    "Igbo"
  ],
  "resume": "Divinité igbo du tonnerre et de la foudre, garante de la justice. Elle frappe par la foudre les auteurs de fautes cachées et venge les faibles contre ceux qui les oppriment. Son emblème est le bélier blanc, qui lui est offert de préférence en sacrifice, et son principal sanctuaire est situé à Ozuzu, en pays etche.",
  "description_detaillee": "Chez les Igbo du sud-est du Nigeria, Amadioha est l'une des grandes puissances religieuses reconnues bien au-delà d'une seule communauté. Son nom est généralement expliqué comme « l'homme du peuple », et le philosophe Ikechukwu Anthony Kanu y voit l'expression de la volonté collective. Il est surtout honoré dans le sud du pays igbo ; selon les localités, on l'appelle aussi Amadiora, Kamalu, Igwe (« le ciel ») ou Ofufe. Kanu le présente comme un fils de Chineke et comme l'agent de Chukwu contre les crimes restés cachés, tandis que le manuel d'Awolalu et Dopamu, cité par Emmanuel Echezolochi Amadi, le place au second rang après Ala.\n\nSa fonction première est la justice : il venge les faibles et frappe les malfaiteurs, voleurs ou sorciers. Quand la foudre tuait quelqu'un ou frappait une maison, l'événement était lu comme un message du dieu, et l'on faisait appel à un dibia, spécialiste rituel, pour découvrir quelle faute avait été commise. D'après Awolalu et Dopamu, la victime n'était pas pleurée, seuls les prêtres d'Amadioha pouvaient l'enterrer, des sacrifices étaient offerts à l'endroit frappé et ses biens revenaient au dieu. Sa couleur est le rouge, son symbole le bélier blanc, qu'on lui sacrifie de préférence, et les animaux qui lui sont voués (bélier, mouton, vache) sont intouchables. Son sanctuaire se trouve d'ordinaire dans un bosquet ; Kanu, reprenant un article de presse, y décrit une longue perche de bambou posée à l'horizontale sur deux fourches, sous laquelle aucun malfaiteur ne pourrait passer impunément. Kanu ajoute qu'il est « parfois » dit l'époux d'Ala, qu'il féconde par la pluie, et qu'il fait respecter les interdits liés à la terre.\n\nLe pays etche, dans l'actuel État de Rivers, se considère comme son foyer : à Ozuzu se trouverait le sanctuaire principal, d'où le culte se serait diffusé dans le reste du pays igbo, et les rites de purification y consistent à transférer la souillure sur une chèvre chassée hors de la communauté. Avant la colonisation, plusieurs oracles portaient son nom ou celui de Kamalu, comme le Kamalu d'Ozuzu ou l'Amadioha d'Eziama, sans jamais égaler l'influence de l'oracle aro d'Arochukwu. Dans la région d'Owerri, certaines maisons mbari, ces ensembles de sculptures d'argile élevés en offrande, lui étaient dédiées aux côtés d'Ala. Kanu le rapproche de Ṣàngó, le dieu yoruba du tonnerre ; les deux figures se ressemblent par leur rôle de justicier, mais Ṣàngó est rattaché par la tradition à un ancien roi d'Oyo, alors que les sources consultées ne prêtent pas de passé humain à Amadioha.",
  "domaines": [
    "tonnerre",
    "foudre",
    "justice",
    "châtiment",
    "pluie"
  ],
  "tags": [
    "foudre-orage"
  ],
  "genealogie": {
    "parents": [],
    "conjoints": [
      "ala"
    ],
    "enfants": [],
    "entites_liees": [
      "chukwu",
      "shango",
      "agwu"
    ]
  },
  "attributs": [
    "bélier blanc",
    "couleur rouge",
    "foudre",
    "perche de bambou du sanctuaire"
  ],
  "recits_associes": [],
  "culte_contemporain": "Amadi (2024) décrit au présent le culte d'Amadioha en pays etche et les rites de purification pratiqués à Ozuzu. Kanu (2021) estime en revanche que la croyance en ces divinités a reculé avec la modernité et la christianisation.",
  "sources": [
    "Kanu, I.A. (2018). Igbo-African Gods and Goddesses. Nnadiebube Journal of Philosophy, 2(2)",
    "Kanu, I.A. (2021). Amadioha in Igbo-African Religion and the Quest for Ecological Balance. In I.A. Kanu (dir.), African Eco-Theology: Meaning, Forms and Expressions. Association for the Promotion of African Studies",
    "Amadi, E.E. (2024). The Religio-Socio-Economic Significance of Ajoku-Ji and Alu-Ubi in Etche, South-South Nigeria. Niger Delta Journal of Gender, Peace & Conflict Studies, 4(1)",
    "Njoku, N.L. (2015). The Dual Image of the Aro in Igbo Development History: An Aftermath of their Role in the Slave Trade. Journal of Retracing Africa, 2(1)",
    "Eghelle, C.S. & Brisibe, W.G. (2025). Expression of Culture through Architecture: Insights from the Mbari Houses of Imo State, Nigeria. ISVS e-journal, 12(3)"
  ],
  "notes": "Les deux textes de Kanu reprennent largement le même passage ; ils ne constituent pas deux témoignages indépendants. La description de la perche de bambou et du mobilier du sanctuaire vient chez Kanu d'un article du quotidien Vanguard (Apollos), et non d'une enquête de terrain publiée. Les données sur le traitement des victimes de la foudre, le rang d'Amadioha après Ala et le nom Ofufe sont connues ici par Amadi (2024), qui cite Awolalu et Dopamu, West African Traditional Religion (1979), ouvrage non consulté directement. Le rang du dieu varie selon les auteurs : second après Ala chez Awolalu et Dopamu, second après Chukwu dans de nombreuses présentations non académiques. Le jour qui lui est consacré n'est pas fixé : Kanu indique Afọ, tandis que Eke n'est attesté que par des sources non académiques (Wikipédia et sites de vulgarisation). Le statut d'époux d'Ala ne repose que sur Kanu, qui précise qu'il est « parfois » ainsi désigné. L'étymologie « homme du peuple » (ou « libre volonté du peuple ») est une interprétation courante plutôt qu'un point établi. Le rôle d'Amadioha comme garant des serments, que l'on jurerait par lui et qu'il frapperait les parjures, est très répandu dans les présentations grand public mais n'a pas été retrouvé dans les sources universitaires consultées ; il reste non vérifié. Il en va de même de la forme Kalu, donnée par Wikipédia comme abréviation de Kalu Akanu (Kamalu). La liste des oracles rivaux de celui d'Arochukwu vient de Njoku, qui s'appuie sur Ottenberg, « Ibo Oracles and Intergroup Relations » (1958), article non consulté. Les travaux d'Arinze (1970), Ilogu, Ikenga-Metuh, Uchendu et Cole et Aniakor n'ont pas pu être lus en texte intégral pour cette fiche."
}
